{
  "name": "destroy_buffer_after_submit",
  "description": "A buffer is destroyed after the only command buffer that captured it has been submitted.",
  "reason": "Ordinary QueueSubmit consumes buffer captures, so completed submitted work does not retain the buffer logically.",
  "version": {
    "major": 2,
    "minor": 0
  },
  "tags": [
    "positive",
    "lifetime",
    "usage",
    "submission"
  ],
  "commands": [
    {
      "cmd": "HelloRenderer",
      "version": {
        "major": 2,
        "minor": 0
      },
      "client_name": "fixture-client"
    },
    {
      "cmd": "RendererHelloReply",
      "version": {
        "major": 2,
        "minor": 0
      },
      "status": "ok",
      "renderer_name": "fixture-renderer"
    },
    {
      "cmd": "CreateBuffer",
      "id": 1,
      "size": 64,
      "usage": [
        "COPY_SRC"
      ]
    },
    {
      "cmd": "CreateBuffer",
      "id": 2,
      "size": 64,
      "usage": [
        "COPY_DST"
      ]
    },
    {
      "cmd": "BeginCommandEncoder",
      "id": 3
    },
    {
      "cmd": "CopyBufferToBuffer",
      "encoder_id": 3,
      "src_buffer_id": 1,
      "src_offset": 0,
      "dst_buffer_id": 2,
      "dst_offset": 0,
      "size": 16
    },
    {
      "cmd": "FinishCommandEncoder",
      "encoder_id": 3,
      "command_buffer_id": 4
    },
    {
      "cmd": "QueueSubmit",
      "command_buffer_ids": [
        4
      ],
      "submission_id": 5
    },
    {
      "cmd": "DestroyBuffer",
      "buffer_id": 1
    }
  ],
  "expected": {
    "outcome": "success"
  }
}
