{
  "name": "compute_pass_dispatch_with_pipeline",
  "description": "Begins a compute pass, binds a pipeline, records one dispatch, ends the pass, and finishes the encoder.",
  "reason": "A live compute pipeline is created and bound before DispatchWorkgroups in the same open compute pass.",
  "notes": "This fixture exercises the active compute-pipeline lifecycle using explicit shader modules and the active lightweight layout model.",
  "version": {
    "major": 2,
    "minor": 0
  },
  "tags": [
    "positive",
    "compute_pass",
    "pipeline",
    "dispatch"
  ],
  "commands": [
    {
      "cmd": "HelloRenderer",
      "version": {
        "major": 2,
        "minor": 0
      },
      "client_name": "fixture-client"
    },
    {
      "cmd": "RendererHelloReply",
      "version": {
        "major": 2,
        "minor": 0
      },
      "status": "ok",
      "renderer_name": "fixture-renderer"
    },
    {
      "cmd": "CreateShaderModule",
      "id": 9000,
      "stage": "COMPUTE",
      "format": "wgsl",
      "entry_point": "main",
      "code": "@compute @workgroup_size(1) fn main() {}"
    },
    {
      "cmd": "CreateComputePipeline",
      "id": 20,
      "compute_shader_module_id": 9000
    },
    {
      "cmd": "BeginCommandEncoder",
      "id": 1
    },
    {
      "cmd": "BeginComputePass",
      "id": 2,
      "encoder_id": 1
    },
    {
      "cmd": "SetPipeline",
      "pass_id": 2,
      "pipeline_id": 20
    },
    {
      "cmd": "DispatchWorkgroups",
      "pass_id": 2,
      "x": 1,
      "y": 1,
      "z": 1
    },
    {
      "cmd": "EndComputePass",
      "pass_id": 2
    },
    {
      "cmd": "FinishCommandEncoder",
      "encoder_id": 1,
      "command_buffer_id": 3
    }
  ],
  "expected": {
    "outcome": "success"
  }
}
