{
  "name": "scene_primitive_wgsl_from_c",
  "version": { "major": 2, "minor": 0 },
  "commands": [
    { "cmd": "HelloRenderer", "version": { "major": 2, "minor": 0 }, "client_name": "scene-runtime" },
    { "cmd": "RendererHelloReply", "version": { "major": 2, "minor": 0 }, "status": "ok", "renderer_name": "datoviz-drp2-runtime" },
    { "cmd": "CreateBuffer", "id": 20, "size": 36, "usage": ["COPY_DST", "VERTEX"] },
    { "cmd": "WriteBuffer", "buffer_id": 20, "offset": 0, "size": 36, "data": "mpkZvwAAAL8AAAAAmpkZPwAAAL8AAAAAAAAAAJqZGT8AAAAA" },
    { "cmd": "CreateBuffer", "id": 21, "size": 12, "usage": ["COPY_DST", "VERTEX"] },
    { "cmd": "WriteBuffer", "buffer_id": 21, "offset": 0, "size": 12, "data": "/wAA/wC0////////" },
    { "cmd": "CreateTexture", "id": 5000, "dimension": "2d", "width": 4, "height": 4, "depth": 1, "format": "rgba8unorm", "usage": ["COPY_SRC", "RENDER_ATTACHMENT"], "mip_level_count": 1, "sample_count": 1 },
    { "cmd": "CreateTexture", "id": 22, "dimension": "2d", "width": 4, "height": 4, "depth": 1, "format": "depth32float", "usage": ["RENDER_ATTACHMENT"], "mip_level_count": 1, "sample_count": 1 },
    { "cmd": "CreateBindGroupLayout", "id": 5001, "entries": [{ "binding": 0, "binding_type": "uniform_buffer", "visibility": ["VERTEX", "FRAGMENT"] }, { "binding": 1, "binding_type": "uniform_buffer", "visibility": ["VERTEX", "FRAGMENT"] }] },
    { "cmd": "CreateBuffer", "id": 5002, "size": 208, "usage": ["COPY_DST", "MAP_WRITE", "UNIFORM"] },
    { "cmd": "CreateBuffer", "id": 5003, "size": 16, "usage": ["COPY_DST", "MAP_WRITE", "UNIFORM"] },
    { "cmd": "CreateBindGroup", "id": 5004, "bind_group_layout_id": 5001, "entries": [{ "binding": 0, "binding_type": "uniform_buffer", "resource_kind": "buffer", "resource_id": 5002, "offset": 0, "size": 208 }, { "binding": 1, "binding_type": "uniform_buffer", "resource_kind": "buffer", "resource_id": 5003, "offset": 0, "size": 16 }] },
    { "cmd": "WriteBuffer", "buffer_id": 5002, "offset": 0, "size": 208, "data": "AACAPwAAAAAAAAAAAAAAAAAAAAAAAIA/AAAAAAAAAAAAAAAAAAAAAAAAgD8AAAAAAAAAAAAAAAAAAAAAAACAPwAAgD8AAAAAAAAAAAAAAAAAAAAAAACAPwAAAAAAAAAAAAAAAAAAAAAAAIA/AAAAAAAAAAAAAAAAAAAAAAAAgD8AAIA/AAAAAAAAAAAAAAAAAAAAAAAAgD8AAAAAAAAAAAAAAAAAAAAAAACAPwAAAAAAAAAAAAAAAAAAAAAAAIA/AAAAAAAAAAAAAAAAAAAAAA==" },
    { "cmd": "WriteBuffer", "buffer_id": 5003, "offset": 0, "size": 16, "data": "AAAAAAAAAAAAAIBCAACAQg==" },
    { "cmd": "CreateShaderModule", "id": 5005, "stage": "VERTEX", "format": "wgsl", "entry_point": "main", "builtin_family": "scene.primitive", "builtin_variant": "default", "builtin_version": 1, "code": "const DVZ_LEGACY_SRGB_BLEND: bool = false;\n// Shared transform pipeline for builtin scene vertex shaders.\n//\n// Bind group layout (group 0):\n//   binding 0: MVP { model, view, proj, time, flags }\n//   binding 1: Viewport { x, y, width, height }\n\nstruct MVP {\n    model: mat4x4f,\n    view: mat4x4f,\n    proj: mat4x4f,\n    time: f32,\n    flags: u32,\n}\n\nstruct Viewport {\n    rect: vec4f,\n}\n\n@group(0) @binding(0) var<uniform> mvp: MVP;\n@group(0) @binding(1) var<uniform> viewport: Viewport;\n\n// Scene matrices use the right-handed OpenGL clip convention (depth [-w, +w]). WebGPU keeps\n// scene-clip Y and lowers only depth into the device [0, w] range.\nfn scene_clip_to_device_clip(scene_clip: vec4f) -> vec4f {\n    return vec4f(scene_clip.xy, 0.5 * (scene_clip.z + scene_clip.w), scene_clip.w);\n}\n\nfn transform(position: vec3f) -> vec4f {\n    let scene_clip = mvp.proj * mvp.view * mvp.model * vec4f(position, 1.0);\n    return scene_clip_to_device_clip(scene_clip);\n}\n\nfn device_clip_to_top_left_pixel(device_clip: vec4f) -> vec2f {\n    let ndc = device_clip.xy / max(abs(device_clip.w), 1e-6);\n    let unit = vec2f(0.5 * ndc.x + 0.5, 0.5 - 0.5 * ndc.y);\n    return unit * viewport.rect.zw;\n}\n\nfn top_left_pixel_to_device_clip(pixel: vec2f, reference_clip: vec4f) -> vec4f {\n    let unit = pixel / max(viewport.rect.zw, vec2f(1.0));\n    let ndc = vec2f(2.0 * unit.x - 1.0, 1.0 - 2.0 * unit.y);\n    return vec4f(ndc * reference_clip.w, reference_clip.z, reference_clip.w);\n}\n\n\nstruct VertexIn {\n    @location(0) position: vec3f,\n    @location(1) color: vec4f,\n}\n\nstruct VertexOut {\n    @builtin(position) position: vec4f,\n    @location(0) color: vec4f,\n}\n\n@vertex\nfn main(input: VertexIn) -> VertexOut {\n    var output: VertexOut;\n    output.position = transform(input.position);\n    output.color = input.color;\n    return output;\n}\n" },
    { "cmd": "CreateShaderModule", "id": 5006, "stage": "FRAGMENT", "format": "wgsl", "entry_point": "main", "builtin_family": "scene.primitive", "builtin_variant": "default", "builtin_version": 1, "code": "const DVZ_LEGACY_SRGB_BLEND: bool = false;\nfn srgb_to_linear(srgb: vec3f) -> vec3f {\n    let clipped = clamp(srgb, vec3f(0.0), vec3f(1.0));\n    let lo = clipped / vec3f(12.92);\n    let hi = pow((clipped + vec3f(0.055)) / vec3f(1.055), vec3f(2.4));\n    return select(hi, lo, clipped <= vec3f(0.04045));\n}\n\nfn semantic_color_to_linear(color: vec4f) -> vec4f {\n    let clipped = clamp(color.rgb, vec3f(0.0), vec3f(1.0));\n    if (DVZ_LEGACY_SRGB_BLEND) {\n        return vec4f(clipped, clamp(color.a, 0.0, 1.0));\n    }\n    return vec4f(srgb_to_linear(clipped), clamp(color.a, 0.0, 1.0));\n}\n\nfn sampled_texture_color_to_linear(color: vec4f, params: vec4f) -> vec4f {\n    if (params.x > 0.5) {\n        return semantic_color_to_linear(color);\n    }\n    return vec4f(color.rgb, clamp(color.a, 0.0, 1.0));\n}\n\n\nstruct FragmentIn {\n    @location(0) color: vec4f,\n}\n\n@fragment\nfn main(input: FragmentIn) -> @location(0) vec4f {\n    return semantic_color_to_linear(input.color);\n}\n" },
    { "cmd": "CreateRenderPipeline", "id": 5007, "vertex_buffer_slots": 2, "vertex_shader_module_id": 5005, "fragment_shader_module_id": 5006, "builtin_pipeline": "scene.primitive", "builtin_version": 1, "bind_group_layout_ids": [5001], "topology": "triangle-list", "vertex_buffers": [{ "array_stride": 12, "step_mode": "vertex", "attributes": [{ "shader_location": 0, "offset": 0, "format": "float32x3" }] }, { "array_stride": 4, "step_mode": "vertex", "attributes": [{ "shader_location": 1, "offset": 0, "format": "unorm8x4" }] }], "raster": { "cull_mode": "none", "front_face": "counter-clockwise" }, "multisample": { "sample_count": 1, "alpha_to_coverage_enabled": false }, "color_targets": [{ "format": "rgba8unorm", "write_mask": ["red", "green", "blue", "alpha"] }], "depth_stencil": { "format": "depth32float", "depth_write_enabled": true, "depth_compare": "less-equal" } },
    { "cmd": "BeginCommandEncoder", "id": 10000 },
    { "cmd": "BeginRenderPass", "id": 10001, "encoder_id": 10000, "color_attachments": [ { "texture_id": 5000, "load_op": "clear", "store_op": "store", "clear_value": { "r": 0, "g": 0, "b": 0, "a": 1 } } ], "render_area": { "x": 0, "y": 0, "width": 4, "height": 4 }, "viewport": { "x": 0, "y": 0, "width": 4, "height": 4 }, "scissor": { "x": 0, "y": 0, "width": 4, "height": 4 }, "depth_stencil_attachment": { "texture_id": 22, "depth_load_op": "clear", "depth_store_op": "store", "access": "write", "depth_clear_value": 1 } },
    { "cmd": "SetViewport", "pass_id": 10001, "x": 0, "y": 0, "width": 4, "height": 4, "min_depth": 0, "max_depth": 1 },
    { "cmd": "SetScissor", "pass_id": 10001, "x": 0, "y": 0, "width": 4, "height": 4 },
    { "cmd": "SetPipeline", "pass_id": 10001, "pipeline_id": 5007 },
    { "cmd": "SetBindGroup", "pass_id": 10001, "slot": 0, "bind_group_id": 5004 },
    { "cmd": "SetVertexBuffer", "pass_id": 10001, "slot": 0, "buffer_id": 20, "offset": 0 },
    { "cmd": "SetVertexBuffer", "pass_id": 10001, "slot": 1, "buffer_id": 21, "offset": 0 },
    { "cmd": "Draw", "pass_id": 10001, "vertex_count": 3, "instance_count": 1, "first_vertex": 0, "first_instance": 0 },
    { "cmd": "EndRenderPass", "pass_id": 10001 },
    { "cmd": "FinishCommandEncoder", "encoder_id": 10000, "command_buffer_id": 10002 },
    { "cmd": "QueueSubmit", "command_buffer_ids": [10002], "submission_id": 10003 }
  ],
  "expected": { "outcome": "success" }
}
