{
  "name": "destroy_buffer_after_readback_reply",
  "description": "A readback buffer is destroyed after its matching QueueSubmitReply fully validates.",
  "reason": "A validated reply consumes the pending readback and releases its logical buffer lifetime dependency.",
  "version": {"major": 2, "minor": 0},
  "tags": ["positive", "buffer", "lifetime", "readback"],
  "commands": [
    {"cmd": "HelloRenderer", "version": {"major": 2, "minor": 0}, "client_name": "fixture-client"},
    {"cmd": "RendererHelloReply", "version": {"major": 2, "minor": 0}, "status": "ok", "renderer_name": "fixture-renderer"},
    {"cmd": "CreateBuffer", "id": 1, "size": 16, "usage": ["MAP_READ"]},
    {"cmd": "BeginCommandEncoder", "id": 2},
    {"cmd": "FinishCommandEncoder", "encoder_id": 2, "command_buffer_id": 3},
    {"cmd": "QueueSubmit", "command_buffer_ids": [3], "submission_id": 4, "readbacks": [{"buffer_id": 1, "offset": 0, "size": 4}]},
    {"cmd": "QueueSubmitReply", "submission_id": 4, "readbacks": [{"buffer_id": 1, "offset": 0, "size": 4, "data": "AAAAAA=="}]},
    {"cmd": "DestroyBuffer", "buffer_id": 1}
  ],
  "expected": {"outcome": "success"}
}
