{
  "name": "render_pass_draw_with_pipeline",
  "description": "Begins a render pass, binds a pipeline, records one draw, ends the pass, and finishes the encoder.",
  "reason": "A render pipeline is bound before Draw in the same open render pass, so the draw satisfies the active pipeline prerequisite.",
  "notes": "The active fixture corpus treats pipeline ids as opaque handles for pass-local binding state because pipeline creation is still deferred.",
  "version": {
    "major": 2,
    "minor": 0
  },
  "tags": [
    "positive",
    "render_pass",
    "pipeline",
    "draw"
  ],
  "commands": [
    {
      "cmd": "CreateTexture",
      "id": 1,
      "dimension": "2d",
      "width": 4,
      "height": 4,
      "depth": 1,
      "format": "rgba8unorm",
      "usage": [
        "RENDER_ATTACHMENT"
      ],
      "mip_level_count": 1,
      "sample_count": 1
    },
    {
      "cmd": "BeginCommandEncoder",
      "id": 2
    },
    {
      "cmd": "BeginRenderPass",
      "id": 3,
      "encoder_id": 2,
      "color_attachments": [
        {
          "texture_id": 1,
          "load_op": "clear",
          "store_op": "store",
          "clear_value": {
            "r": 0,
            "g": 0,
            "b": 0,
            "a": 1
          }
        }
      ]
    },
    {
      "cmd": "SetPipeline",
      "pass_id": 3,
      "pipeline_id": 1001
    },
    {
      "cmd": "Draw",
      "pass_id": 3,
      "vertex_count": 3,
      "instance_count": 1,
      "first_vertex": 0,
      "first_instance": 0
    },
    {
      "cmd": "EndRenderPass",
      "pass_id": 3
    },
    {
      "cmd": "FinishCommandEncoder",
      "encoder_id": 2,
      "command_buffer_id": 4
    }
  ],
  "expected": {
    "outcome": "success"
  }
}
