{
  "name": "scene_static_render_from_c",
  "version": { "major": 2, "minor": 0 },
  "commands": [
    { "cmd": "HelloRenderer", "version": { "major": 2, "minor": 0 }, "client_name": "scene-fixture" },
    { "cmd": "RendererHelloReply", "version": { "major": 2, "minor": 0 }, "status": "ok", "renderer_name": "datoviz-drp2-fixture" },
    { "cmd": "CreateBuffer", "id": 20, "size": 36, "usage": ["COPY_DST", "VERTEX"] },
    { "cmd": "WriteBuffer", "buffer_id": 20, "offset": 0, "size": 16, "data": "AAAAAAAAAAAAAAAAAAAAAA==" },
    { "cmd": "CreateShaderModule", "id": 9000, "stage": "VERTEX", "format": "wgsl", "entry_point": "main", "code": "const DVZ_LEGACY_SRGB_BLEND: bool = false;\n@vertex fn main(@location(0) position: vec3f) -> @builtin(position) vec4f { return vec4f(position, 1.0); }" },
    { "cmd": "CreateShaderModule", "id": 9001, "stage": "FRAGMENT", "format": "wgsl", "entry_point": "main", "code": "const DVZ_LEGACY_SRGB_BLEND: bool = false;\n@fragment fn main() -> @location(0) vec4f { return vec4f(1.0, 1.0, 1.0, 1.0); }" },
    { "cmd": "CreateRenderPipeline", "id": 10, "vertex_buffer_slots": 1, "vertex_shader_module_id": 9000, "fragment_shader_module_id": 9001, "topology": "triangle-list", "vertex_buffers": [{ "array_stride": 12, "step_mode": "vertex", "attributes": [{ "shader_location": 0, "offset": 0, "format": "float32x3" }] }], "multisample": { "sample_count": 1, "alpha_to_coverage_enabled": false }, "color_targets": [{ "format": "rgba8unorm", "write_mask": ["red", "green", "blue", "alpha"] }] },
    { "cmd": "CreateTexture", "id": 1, "dimension": "2d", "width": 4, "height": 4, "depth": 1, "format": "rgba8unorm", "usage": ["COPY_SRC", "COPY_DST", "RENDER_ATTACHMENT"], "mip_level_count": 1, "sample_count": 1 },
    { "cmd": "BeginCommandEncoder", "id": 2 },
    { "cmd": "BeginRenderPass", "id": 3, "encoder_id": 2, "color_attachments": [ { "texture_id": 1, "load_op": "load", "store_op": "store", "clear_value": { "r": 0, "g": 0, "b": 0, "a": 1 } } ] },
    { "cmd": "SetPipeline", "pass_id": 3, "pipeline_id": 10 },
    { "cmd": "SetVertexBuffer", "pass_id": 3, "slot": 0, "buffer_id": 20, "offset": 0 },
    { "cmd": "Draw", "pass_id": 3, "vertex_count": 3, "instance_count": 1, "first_vertex": 0, "first_instance": 0 },
    { "cmd": "EndRenderPass", "pass_id": 3 },
    { "cmd": "FinishCommandEncoder", "encoder_id": 2, "command_buffer_id": 4 },
    { "cmd": "QueueSubmit", "command_buffer_ids": [4], "submission_id": 5 }
  ],
  "expected": { "outcome": "success" }
}
