{
  "name": "sampler_create_and_bind_basic",
  "description": "Create a sampler and bind it alongside a sampled texture in a render pass.",
  "version": {
    "major": 2,
    "minor": 0
  },
  "tags": [
    "positive",
    "sampler",
    "bind_group"
  ],
  "commands": [
    {
      "cmd": "HelloRenderer",
      "version": { "major": 2, "minor": 0 },
      "client_name": "fixture-client"
    },
    {
      "cmd": "RendererHelloReply",
      "version": { "major": 2, "minor": 0 },
      "status": "ok",
      "renderer_name": "fixture-renderer"
    },
    {
      "cmd": "CreateTexture",
      "id": 1,
      "dimension": "2d",
      "width": 2,
      "height": 2,
      "depth": 1,
      "format": "rgba8unorm",
      "usage": ["TEXTURE_BINDING"],
      "mip_level_count": 1,
      "sample_count": 1
    },
    {
      "cmd": "CreateSampler",
      "id": 3,
      "mag_filter": "linear",
      "min_filter": "linear",
      "address_mode_u": "clamp-to-edge",
      "address_mode_v": "clamp-to-edge"
    },
    {
      "cmd": "CreateBindGroupLayout",
      "id": 4,
      "entries": [
        { "binding": 0, "binding_type": "sampled_texture", "visibility": ["FRAGMENT"] },
        { "binding": 1, "binding_type": "sampler", "visibility": ["FRAGMENT"] }
      ]
    },
    {
      "cmd": "CreateShaderModule",
      "id": 9000,
      "stage": "VERTEX",
      "format": "wgsl",
      "entry_point": "main",
      "code": "@vertex fn main(@builtin(vertex_index) idx: u32) -> @builtin(position) vec4f { var pos = array<vec2f, 3>(vec2f(-1.0, -1.0), vec2f(3.0, -1.0), vec2f(-1.0, 3.0)); return vec4f(pos[idx], 0.0, 1.0); }"
    },
    {
      "cmd": "CreateShaderModule",
      "id": 9001,
      "stage": "FRAGMENT",
      "format": "wgsl",
      "entry_point": "main",
      "code": "@group(0) @binding(0) var src: texture_2d<f32>; @group(0) @binding(1) var samp: sampler; @fragment fn main(@builtin(position) pos: vec4f) -> @location(0) vec4f { return textureSample(src, samp, vec2f(0.5, 0.5)); }"
    },
    {
      "cmd": "CreateRenderPipeline",
      "id": 10,
      "vertex_buffer_slots": 0,
      "vertex_buffers": [],
      "bind_group_layout_ids": [4],
      "vertex_shader_module_id": 9000,
      "fragment_shader_module_id": 9001,
      "color_targets": [{ "format": "rgba8unorm" }]
    },
    {
      "cmd": "CreateBindGroup",
      "id": 6,
      "bind_group_layout_id": 4,
      "entries": [
        {
          "binding": 0,
          "binding_type": "sampled_texture",
          "resource_kind": "texture",
          "resource_id": 1
        },
        {
          "binding": 1,
          "binding_type": "sampler",
          "resource_kind": "sampler",
          "resource_id": 3
        }
      ]
    },
    {
      "cmd": "CreateTexture",
      "id": 5,
      "dimension": "2d",
      "width": 2,
      "height": 2,
      "depth": 1,
      "format": "rgba8unorm",
      "usage": ["RENDER_ATTACHMENT"],
      "mip_level_count": 1,
      "sample_count": 1
    },
    {
      "cmd": "BeginCommandEncoder",
      "id": 20
    },
    {
      "cmd": "BeginRenderPass",
      "id": 21,
      "encoder_id": 20,
      "color_attachments": [
        {
          "texture_id": 5,
          "load_op": "clear",
          "store_op": "store",
          "clear_value": { "r": 0, "g": 0, "b": 0, "a": 1 }
        }
      ]
    },
    {
      "cmd": "SetPipeline",
      "pass_id": 21,
      "pipeline_id": 10
    },
    {
      "cmd": "SetBindGroup",
      "pass_id": 21,
      "slot": 0,
      "bind_group_id": 6,
      "dynamic_offsets": []
    },
    {
      "cmd": "Draw",
      "pass_id": 21,
      "vertex_count": 3,
      "instance_count": 1,
      "first_vertex": 0,
      "first_instance": 0
    },
    {
      "cmd": "EndRenderPass",
      "pass_id": 21
    },
    {
      "cmd": "FinishCommandEncoder",
      "encoder_id": 20,
      "command_buffer_id": 22
    },
    {
      "cmd": "QueueSubmit",
      "command_buffer_ids": [22],
      "submission_id": 23
    }
  ],
  "expected": {
    "outcome": "success"
  }
}
