{
  "name": "replace_buffer_after_submit",
  "description": "CreateBuffer replaces a buffer id after its only recorded capture has submitted.",
  "reason": "Submitted buffer captures do not retain the logical buffer, so a compatible replacement may proceed.",
  "version": {"major": 2, "minor": 0},
  "tags": ["positive", "buffer", "lifetime", "replacement", "submission"],
  "commands": [
    {"cmd": "HelloRenderer", "version": {"major": 2, "minor": 0}, "client_name": "fixture-client"},
    {"cmd": "RendererHelloReply", "version": {"major": 2, "minor": 0}, "status": "ok", "renderer_name": "fixture-renderer"},
    {"cmd": "CreateBuffer", "id": 1, "size": 64, "usage": ["COPY_SRC"]},
    {"cmd": "CreateBuffer", "id": 2, "size": 64, "usage": ["COPY_DST"]},
    {"cmd": "BeginCommandEncoder", "id": 3},
    {"cmd": "CopyBufferToBuffer", "encoder_id": 3, "src_buffer_id": 1, "src_offset": 0, "dst_buffer_id": 2, "dst_offset": 0, "size": 16},
    {"cmd": "FinishCommandEncoder", "encoder_id": 3, "command_buffer_id": 4},
    {"cmd": "QueueSubmit", "command_buffer_ids": [4]},
    {"cmd": "CreateBuffer", "id": 1, "size": 128, "usage": ["COPY_SRC"]}
  ],
  "expected": {"outcome": "success"}
}
